Unnamed: 0,EudraCT Number:,Sponsor Protocol Number:,Sponsor Name:,Full Title:,Start Date:,Medical condition:,Disease 1:,Population Age:,Gender:,Trial protocol:,Link:,Disease 2:,Disease 3:,Disease:,Disease 4:,COVID-19
,2020-001113-21,NDPHRECOVERY,University of Oxford,Randomised Evaluation of COVID-19 Therapy (RECOVERY),2020-03-17,COVID-19 (infection with SARS-CoV-2 virus),"Version: 21.1, SOC Term: 10021881 - Infections and infestations, Classification Code: 10035737, Term: Pneumonia viral, Level: PT","Preterm newborn infants, Newborns, Infants and toddlers, Children, Adolescents, Under 18, Adults, Elderly","Male, Female",GB(GB - no longer in EU/EEA) ,https://www.clinicaltrialsregister.eu/ctr-search/search?query=eudract_number:2020-001113-21,"Version: 20.1, SOC Term: 10021881 - Infections and infestations, Classification Code: 10061982, Term: Severe acute respiratory syndrome, Level: PT",,,,
,2020-001441-39,VIR20001,University of Oxford,"Chloroquine/ hydroxychloroquine prevention of coronavirus disease (COVID-19) in the healthcare setting; a randomised, placebo-controlled prophylaxis study (COPCOV)",2020-05-12,"COVID-19, acute respiratory illness","Version: 23.0, SOC Term: 100000004862, Classification Code: 10053983, Term: Corona virus infection, Level: LLT","Adults, Elderly","Male, Female",GB(GB - no longer in EU/EEA) IT(Prematurely Ended) ,https://www.clinicaltrialsregister.eu/ctr-search/search?query=eudract_number:2020-001441-39,,,,,
,2020-001684-89,RG_20-030,University of Birmingham,CATALYST - A randomised phase II proof of principle multi-arm multi-stage trial designed to guide the selection of interventions for phase III trials in hospitalised patients with COVID-19 infection.,2020-05-05,COVID-19,"Version: 20.1, SOC Term: 100000004855, Classification Code: 10047468, Term: Viral lower respiratory tract infections, Level: HLT","Adolescents, Under 18, Adults, Elderly","Male, Female",GB(GB - no longer in EU/EEA) ,https://www.clinicaltrialsregister.eu/ctr-search/search?query=eudract_number:2020-001684-89,,,,,
,2020-003486-19,1.002.20,University of Dundee,"A randomised, double-blind, placebo-controlled trial of SFX-01 or placebo on a backbone of best standard care, to improve outcomes in patients with community acquired pneumonia and suspected or con...",2020-10-08,Community acquired pneumonia with suspected or confirmed SARS-CoV-2 infection,"Version: 20.1, SOC Term: 10021881 - Infections and infestations, Classification Code: 10066724, Term: Acute pneumonia, Level: LLT","Adults, Elderly","Male, Female",GB(GB - no longer in EU/EEA) ,https://www.clinicaltrialsregister.eu/ctr-search/search?query=eudract_number:2020-003486-19,"Version: 20.1, SOC Term: 10021881 - Infections and infestations, Classification Code: 10010120, Term: Community acquired pneumonia, Level: LLT","Version: 23.0, SOC Term: 10021881 - Infections and infestations, Classification Code: 10084380, Term: COVID-19 pneumonia, Level: PT",,"Version: 21.1, SOC Term: 10038738 - Respiratory, thoracic and mediastinal disorders, Classification Code: 10001052, Term: Acute respiratory distress syndrome, Level: PT",
,2020-001860-27,UoL001542,University of Liverpool,AGILE: Seamless Phase I/IIa Platform for the Rapid Evaluation of Candidates for COVID-19 treatment,2020-05-12,"Coronavirus-induced disease (COVID-19) (SARS coronavirus 2, or SARS-CoV-2)","Version: 23.0, SOC Term: 10021881 - Infections and infestations, Classification Code: 10051905, Term: Coronavirus infection, Level: PT","Adults, Elderly","Male, Female",GB(GB - no longer in EU/EEA) ,https://www.clinicaltrialsregister.eu/ctr-search/search?query=eudract_number:2020-001860-27,,,,,
,2020-002494-10,,Queen Mary University of London,Personalised Electronic Record Supported OptimisatioN when ALone  for Patients with Hypertension- Pilot Study for Remote Medical Management of Hypertension During the COVID-19 Pandemic ,2020-07-17,Hypertension,"Version: 21.1, SOC Term: 100000004866, Classification Code: 10081425, Term: Arterial hypertension, Level: LLT","Adults, Elderly","Male, Female",GB(GB - no longer in EU/EEA) ,https://www.clinicaltrialsregister.eu/ctr-search/search?query=eudract_number:2020-002494-10,,,,,
