EudraCT Number:,Sponsor Protocol Number:,Sponsor Name:,Full Title:,Start Date:,Medical condition:,Disease 1:,Population Age:,Gender:,Trial protocol:,Link:,Disease:,Disease 2:,Disease 3:,Disease 4:,COVID-19
2015-004726-34,SHP620-302,"Takeda Development Center Americas, Inc.","A Phase 3, multicenter, randomized, double-blind, double-dummy, active-controlled study to assess the efficacy and safety of maribavir compared to valganciclovir for the treatment of cytomegaloviru...",2017-09-01,Cytomegalovirus Infection in Hematopoietic Stem Cell Transplant Recipients,"Version: 20.0, SOC Term: 100000004862, Classification Code: 10021819, Term: Infection in marrow transplant recipients, Level: LLT","Adolescents, Under 18, Adults, Elderly","Male, Female",HU(Completed) DE(Completed) GB(GB - no longer in EU/EEA) ES(Ongoing) BE(Completed) CZ(Completed) PL(Completed) FR(Completed) HR(Completed) IT(Ongoing) GR(Completed) AT(Completed) Outside EU/EEA ,https://www.clinicaltrialsregister.eu/ctr-search/search?query=eudract_number:2015-004726-34,,,,,
2016-004676-22,M16-066,AbbVie Deutschland GmbH & Co. KG,"A Multicenter, Randomized, Double-Blind, Placebo Controlled 52-Week Maintenance and an Open-Label Extension Study of the Efficacy and Safety of Risankizumab in Subjects with Ulcerative Colitis Who ...",2019-01-14,Ulcerative Colitis,"Version: 20.0, SOC Term: 10017947 - Gastrointestinal disorders, Classification Code: 10009900, Term: Colitis ulcerative, Level: PT","Adolescents, Under 18, Adults, Elderly","Male, Female",BE(Ongoing) SK(Ongoing) AT(Ongoing) ES(Ongoing) SE(Ongoing) NL(Ongoing) DK(Ongoing) GR(Ongoing) PL(Ongoing) DE(Ongoing) LT(Ongoing) PT(Ongoing) GB(GB - no longer in EU/EEA) LV(Ongoing) SI(Ongoing) BG(Ongoing) HR(Ongoing) FR(Not Authorised) IT(Ongoing) ,https://www.clinicaltrialsregister.eu/ctr-search/search?query=eudract_number:2016-004676-22,,,,,
2016-004719-10,AC-058B303,Actelion Pharmaceuticals Ltd.,"Multicenter, non-comparative extension to study AC-058B301, to investigate the long-term safety, tolerability, and control of disease of ponesimod 20 mg in subjects with relapsing multiple sclerosis",2017-10-02,relapsing multiple sclerosis,"Version: 20.0, SOC Term: 10029205 - Nervous system disorders, Classification Code: 10063400, Term: Secondary progressive multiple sclerosis, Level: PT",Adults,"Male, Female",ES(Ongoing) SE(Completed) PL(Ongoing) CZ(Ongoing) BG(Ongoing) LV(Ongoing) HU(Ongoing) LT(Ongoing) PT(Ongoing) HR(Ongoing) GB(GB - no longer in EU/EEA) FI(Ongoing) GR(Ongoing) RO(Ongoing) ,https://www.clinicaltrialsregister.eu/ctr-search/search?query=eudract_number:2016-004719-10,,"Version: 20.0, SOC Term: 10029205 - Nervous system disorders, Classification Code: 10063399, Term: Relapsing-remitting multiple sclerosis, Level: PT",,,
2019-002621-30,M19-063,AbbVie Deutschland GmbH & Co. KG,"A Randomized, Open Label Phase 3 Study Evaluating Safety and Efficacy of Venetoclax in combination with Azacitidine after allogeneic Stem Cell Transplantation in Subjects with Acute Myeloid Leukemi...",2020-06-10,Acute Myeloid Leukemia (AML),,"Adolescents, Under 18, Adults, Elderly","Male, Female",GB(GB - no longer in EU/EEA) FR(Ongoing) DE(Ongoing) CZ(Ongoing) ES(Ongoing) IT(Ongoing) HU(Ongoing) GR(Ongoing) ,https://www.clinicaltrialsregister.eu/ctr-search/search?query=eudract_number:2019-002621-30,,,,,
2016-002154-20,CLCZ696G2301,Novartis Pharma Services AG,"A multi-center, randomized, double-blind, active-controlled, parallel-group Phase 3 study to evaluate the efficacy and safety of LCZ696 compared to ramipril on morbidity and mortality in high risk ...",2017-03-28,Left ventricular dysfunction following an acute myocardial infarction.,"Version: 20.0, SOC Term: 10007541 - Cardiac disorders, Classification Code: 10000891, Term: Acute myocardial infarction, Level: PT","Adults, Elderly","Male, Female",DE(Completed) PT(Completed) CZ(Completed) GB(GB - no longer in EU/EEA) GR(Completed) AT(Completed) SK(Completed) NL(Completed) ES(Completed) HU(Completed) BE(Completed) DK(Completed) SE(Completed) FI(Completed) BG(Completed) HR(Completed) IT(Completed) ,https://www.clinicaltrialsregister.eu/ctr-search/search?query=eudract_number:2016-002154-20,,,,,
2017-004703-51,COMB157G2399,Novartis Pharma AG,"An open-label, single arm, multi-center extension study evaluating long-term safety, tolerability and effectiveness of ofatumumab in subjects with relapsing multiple sclerosis ",2019-01-10,Multiple sclerosis,"Version: 20.0, SOC Term: 10029205 - Nervous system disorders, Classification Code: 10048393, Term: Multiple sclerosis relapse, Level: PT",Adults,"Male, Female",DE(Ongoing) SK(Ongoing) HU(Ongoing) GB(GB - no longer in EU/EEA) NL(Ongoing) AT(Ongoing) FR(Ongoing) PT(Ongoing) ES(Ongoing) CZ(Ongoing) SE(Ongoing) LT(Ongoing) DK(Ongoing) FI(Ongoing) BE(Ongoing) LV(Ongoing) GR(Ongoing) HR(Ongoing) ,https://www.clinicaltrialsregister.eu/ctr-search/search?query=eudract_number:2017-004703-51,,,,,
2016-000674-38,M14-533,AbbVie Deutschland GmbH & Co. KG,"A Phase 3 Multicenter, Long-Term Extension Study to Evaluate the Safety and Efficacy of Upadacitinib (ABT-494) in Subjects with Ulcerative Colitis (UC)",2016-09-20,Ulcerative Colitis,"Version: 20.0, SOC Term: 10017947 - Gastrointestinal disorders, Classification Code: 10009900, Term: Colitis ulcerative, Level: PT","Adolescents, Under 18, Adults, Elderly","Male, Female",SK(Ongoing) NL(Ongoing) CZ(Ongoing) AT(Ongoing) FI(Ongoing) PL(Ongoing) SE(Completed) GB(GB - no longer in EU/EEA) DE(Ongoing) LV(Ongoing) GR(Ongoing) EE(Ongoing) IE(Ongoing) HU(Ongoing) PT(Ongoing) LT(Ongoing) BE(Ongoing) NO(Ongoing) ES(Ongoing) HR(Ongoing) IT(Ongoing) RO(Ongoing) ,https://www.clinicaltrialsregister.eu/ctr-search/search?query=eudract_number:2016-000674-38,,,,,
2016-002937-31,MA30143,F. Hoffmann-La Roche Ltd,"An Open-Label, single-arm study to evaluate the effectiveness and safety of Ocrelizumab in patients with early stage relapsing remitting multiple sclerosis ",2017-09-12,Relapsing remitting multiple sclerosis (RRMS),"Version: 20.1, SOC Term: 10029205 - Nervous system disorders, Classification Code: 10028245, Term: Multiple sclerosis, Level: PT",Adults,"Male, Female",NO(Ongoing) SE(Ongoing) AT(Completed) DK(Completed) DE(Ongoing) PT(Ongoing) BE(Ongoing) HU(Ongoing) PL(Ongoing) SK(Ongoing) ES(Ongoing) BG(Ongoing) SI(Ongoing) NL(Ongoing) GB(GB - no longer in EU/EEA) FR(Ongoing) HR(Ongoing) IT(Ongoing) ,https://www.clinicaltrialsregister.eu/ctr-search/search?query=eudract_number:2016-002937-31,,"Version: 21.1, SOC Term: 10029205 - Nervous system disorders, Classification Code: 10063399, Term: Relapsing-remitting multiple sclerosis, Level: PT","Version: 20.0, SOC Term: 10029205 - Nervous system disorders, Classification Code: 10048393, Term: Multiple sclerosis relapse, Level: PT","Version: 20.1, SOC Term: 10029205 - Nervous system disorders, Classification Code: 10039720, Term: Sclerosis multiple, Level: LLT",
2016-003191-50,M16-000,AbbVie Deutschland GmbH & Co. KG,"A Multicenter, Randomized, Double-Blind, Placebo Controlled 52-Week Maintenance and an Open-Label Extension Study of the Efficacy and Safety of Risankizumab in Subjects with Crohn's Disease",2017-08-23,Crohn's disease,"Version: 20.0, SOC Term: 100000004856, Classification Code: 10013099, Term: Disease Crohns, Level: LLT","Adolescents, Under 18, Adults, Elderly","Male, Female",SK(Ongoing) DK(Ongoing) DE(Ongoing) PT(Ongoing) CZ(Ongoing) GB(GB - no longer in EU/EEA) LV(Ongoing) IE(Ongoing) BG(Ongoing) AT(Ongoing) PL(Ongoing) NL(Ongoing) EE(Ongoing) SE(Ongoing) ES(Ongoing) GR(Ongoing) NO(Ongoing) LT(Ongoing) BE(Ongoing) HR(Ongoing) FR(Ongoing) IT(Ongoing) RO(Ongoing) ,https://www.clinicaltrialsregister.eu/ctr-search/search?query=eudract_number:2016-003191-50,,,,,
